itemname,price
Funnel Neck Fleece Jacket with Stormwear,19.50
Textured Fleece Jacket with Stormwear,49.50
Funnel Neck Fleece Jacket with Stormwear,45.00
Textured Chenille Fleece Jacket with Stormwear,45.00
Funnel Neck Fleece Jacket with Stormwear,49.50
Pure Cotton Fleece Jacket,39.50
Hooded Fleece Jacket with Stormwear,99.00
Textured Fleece Jacket,65.00
Pure Cotton Striped Half Zip Top,39.50
Fleece Gilet with StayNEW,17.50
Textured Fleece Gilet with Stormwear,25.00
Supersoft Fleece Dressing Gown,29.50
2in Longer Supersoft Fleece Dressing Gown,35.00
Supersoft Fleece Dressing Gown with Belt,29.50
Fleece Dressing Gown with Belt,19.50
Shawl Neck Fleece Dressing Gown,29.50
Fleece Joggers with StayNEW,17.50
Big & Tall Fleece Joggers,17.50
Crew Neck Fleece Top with Stormwear,12.50
Pure Cotton Checked Shacket with Pocket,45.00
